{
  "id": "anchor-1",
  "plan_version_id": "synthetic-plan-v1",
  "resource_type": "camera",
  "resource_id": "camera-1",
  "position": {
    "x": 0.25,
    "y": 0.4
  },
  "rotation_degrees": 90,
  "field_of_view_degrees": 77,
  "layer_id": "cameras",
  "revision": 1,
  "effective_from": "2026-09-12T12:00:00Z",
  "effective_to": null
}
